{
  "$schema": "../spec.schema.json",
  "id": "SPEC-0008",
  "title": "Web Next.js — fluxo completo e dashboard do portfólio",
  "status": "draft",
  "type": "feature",
  "created": "2026-06-12",
  "updated": "2026-06-12",
  "authors": ["nikolasdtesch@gmail.com"],
  "summary": "Implementar o cliente web em Next.js com App Router: autenticação (login/registro), dashboard do portfólio (posições, P/L, alocação em gráfico de pizza), listagem de ativos e formulário de lançamento de transações. É o cliente principal e a principal superfície de demonstração do projeto.",
  "motivation": "Com o backend (SPEC-0006) e cotações (SPEC-0007) prontos, o cliente web é o passo seguinte do roadmap (SPEC §11 item 5). Ele entrega a proposta de valor ao usuário final: ver o patrimônio consolidado, lançar operações e acompanhar P/L em tempo real.",
  "related": {
    "prd": ["PRD §3", "PRD §4", "PRD §5"],
    "spec_doc": ["SPEC §1", "SPEC §2", "SPEC §5"],
    "business_rules": ["RN-01", "RN-09", "RN-10", "RN-11"],
    "adrs": ["ADR-0001"],
    "depends_on": ["SPEC-0006", "SPEC-0007", "SPEC-0004"]
  },
  "scope": {
    "in_scope": [
      "Inicialização do apps/web com Next.js 14+ (App Router), TypeScript, Tailwind usando @databolsa/ui.",
      "Páginas: /login, /register, /dashboard (rota protegida), /assets (lista), /assets/new, /assets/:id (detalhes + transações), /assets/:id/transactions/new.",
      "Middleware Next.js para proteção de rotas (redireciona para /login se sem JWT).",
      "Dashboard: cards de patrimônio total, variação do dia, gráfico de alocação (Recharts doughnut), tabela de posições com P/L colorido.",
      "Indicador visual stale (RN-10): ícone/cor âmbar quando cotação está desatualizada.",
      "Formulário de transação: tipo (BUY/SELL), data, preço unitário, quantidade, taxas; validação client-side.",
      "Integração com a API REST via fetch/axios com interceptor de token.",
      "Responsividade mobile-first usando os tokens de breakpoint de @databolsa/ui."
    ],
    "out_of_scope": [
      "Gráfico de histórico (série temporal) — post-MVP.",
      "Edição de ativos já cadastrados.",
      "Export CSV/PDF do portfólio.",
      "Notificações push.",
      "Dark mode toggle (infraestrutura existe via @databolsa/ui, mas ativação por preferência do usuário é post-MVP).",
      "Testes E2E automatizados — cobertos em SPEC-0010."
    ]
  },
  "requirements": [
    {
      "id": "REQ-01",
      "description": "Fluxo de autenticação completo: registro, login, logout e refresh automático do access token.",
      "priority": "must"
    },
    {
      "id": "REQ-02",
      "description": "Dashboard exibe patrimônio_total_brl, lista de posições com qtd_atual, preco_medio, valor_atual_brl, lucro_prejuizo_brl (R$ e %), alocacao_pct.",
      "rule_ref": "RN-01",
      "priority": "must"
    },
    {
      "id": "REQ-03",
      "description": "Posições com is_stale=true exibem indicador visual (cor âmbar, tooltip explicativo) sem quebrar a tela.",
      "rule_ref": "RN-10",
      "priority": "must"
    },
    {
      "id": "REQ-04",
      "description": "Formulário de nova transação valida client-side (campos obrigatórios, quantidade > 0, preço > 0) e exibe erro de API quando SELL excede posição.",
      "rule_ref": "RN-02",
      "priority": "must"
    },
    {
      "id": "REQ-05",
      "description": "Todos os valores monetários e percentuais usam font-mono e exibem sinal +/− para lucro/perda (acessibilidade — cor não é o único indicador).",
      "priority": "must"
    },
    {
      "id": "REQ-06",
      "description": "A aplicação é responsiva e utilizável em viewport mobile (≥375px).",
      "priority": "should"
    }
  ],
  "data_model": [
    {
      "entity": "n/a",
      "change": "none",
      "fields": [],
      "notes": "Frontend puro; sem mudança de schema."
    }
  ],
  "api": [],
  "acceptance_criteria": [
    {
      "id": "AC-01",
      "given": "usuário não autenticado",
      "when": "acessa /dashboard",
      "then": "é redirecionado para /login"
    },
    {
      "id": "AC-02",
      "given": "usuário com portfólio de 3 ativos",
      "when": "acessa /dashboard",
      "then": "vê patrimônio total, gráfico de alocação com 3 fatias e tabela com P/L correto"
    },
    {
      "id": "AC-03",
      "given": "ativo com cotação stale",
      "when": "visualiza a tabela de posições",
      "then": "linha tem indicador âmbar com tooltip 'cotação desatualizada'"
    },
    {
      "id": "AC-04",
      "given": "formulário de venda com quantidade > posição",
      "when": "submete",
      "then": "API retorna 422 e a mensagem de erro é exibida inline no formulário"
    }
  ],
  "test_plan": [
    {
      "id": "TC-01",
      "description": "Testes unitários de componentes críticos (PositionTable, AllocationChart, TransactionForm) com React Testing Library, API mockada com MSW.",
      "kind": "unit",
      "covers": ["REQ-02", "REQ-03", "REQ-04", "REQ-05"],
      "mocks_external": true
    },
    {
      "id": "TC-02",
      "description": "Teste do middleware de proteção de rota: acesso a /dashboard sem cookie JWT redireciona para /login.",
      "kind": "unit",
      "covers": ["REQ-01", "AC-01"],
      "mocks_external": true
    },
    {
      "id": "TC-03",
      "description": "Teste de exibição de stale: componente recebe is_stale=true e renderiza o indicador âmbar (AC-03).",
      "kind": "unit",
      "covers": ["REQ-03", "AC-03"],
      "mocks_external": true
    }
  ],
  "tasks": [
    {
      "id": "T-01",
      "description": "Inicializar apps/web com Next.js, TypeScript, Tailwind configurado com @databolsa/ui preset.",
      "target": "apps/web",
      "done": false
    },
    {
      "id": "T-02",
      "description": "Implementar AuthContext + interceptor de refresh token automático.",
      "target": "apps/web",
      "done": false
    },
    {
      "id": "T-03",
      "description": "Implementar middleware de proteção de rotas (app/middleware.ts).",
      "target": "apps/web",
      "done": false
    },
    {
      "id": "T-04",
      "description": "Implementar páginas /login e /register.",
      "target": "apps/web",
      "done": false
    },
    {
      "id": "T-05",
      "description": "Implementar /dashboard com PortfolioSummary, AllocationChart (Recharts) e PositionTable.",
      "target": "apps/web",
      "done": false
    },
    {
      "id": "T-06",
      "description": "Implementar /assets, /assets/new e /assets/:id (detalhes + histórico de transações).",
      "target": "apps/web",
      "done": false
    },
    {
      "id": "T-07",
      "description": "Implementar /assets/:id/transactions/new com formulário validado.",
      "target": "apps/web",
      "done": false
    },
    {
      "id": "T-08",
      "description": "Escrever testes unitários de componentes (TC-01..TC-03) com React Testing Library + MSW.",
      "target": "apps/web",
      "done": false
    }
  ],
  "risks": [
    "Hidratação SSR/cliente com tokens JWT em cookie httpOnly — usar middleware Next.js para validar no servidor sem expor o token ao JS do cliente.",
    "Recharts não é SSR-safe por padrão — usar dynamic import com ssr:false para os componentes de gráfico.",
    "Precisão decimal na exibição: formatar valores com Intl.NumberFormat para BRL, nunca operações JS nativas em floats."
  ],
  "observability": [],
  "rollback": "Reverter commits de apps/web. Backend e banco não são afetados."
}
