{
  "$schema": "../spec.schema.json",
  "id": "SPEC-0019",
  "title": "Expandir moedas fiat e cripto no conversor",
  "status": "verified",
  "type": "feature",
  "created": "2026-06-15",
  "updated": "2026-06-15",
  "authors": [
    "Arquiteto (Subagente)"
  ],
  "summary": "Expandir a gama de moedas fiat e criptomoedas na ferramenta de conversão de moedas (CurrencyConverter), redesenhando a interface com suporte a seleção de destino e integrando um mecanismo de cache resiliente (RN-10).",
  "motivation": "A versão inicial do conversor possui uma quantidade muito limitada de moedas fiat e não expõe criptomoedas no frontend. A melhoria traz mais flexibilidade para os usuários realizarem simulações rápidas de cotação.",
  "related": {
    "prd": [
      "PRD §7"
    ],
    "spec_doc": [
      "SPEC §7"
    ],
    "business_rules": [
      "RN-10"
    ],
    "adrs": [
      "ADR-0007"
    ]
  },
  "scope": {
    "in_scope": [
      "Expansão de moedas fiat suportadas para USD, EUR, GBP, CAD, AUD, JPY, CHF, CNY, ARS no backend e frontend.",
      "Expansão do mapeamento de criptomoedas no ticker-map.ts para incluir DOGE, AVAX, SHIB, TRX, TON.",
      "Reformulação da interface do CurrencyConverter.tsx para oferecer abas Fiat e Cripto.",
      "Dropdown dinâmico de destino (BRL para fiat; BRL e USD para cripto) no frontend.",
      "Mecanismo de fallbackRates na API convert/route.ts para degradação graciosa com dados stale (RN-10).",
      "Ajuste na formatação de taxas unitárias para suportar 8 casas decimais em criptoativos de baixo valor."
    ],
    "out_of_scope": [
      "Histórico gráfico de câmbio no conversor.",
      "Integração com outras APIs de câmbio além de AwesomeAPI e CoinGecko.",
      "Adicionar conversões de fiat para outros destinos além de BRL na API."
    ]
  },
  "requirements": [
    {
      "id": "REQ-01",
      "description": "O frontend deve permitir selecionar entre moedas Fiat e Cripto através de abas ou controles similares.",
      "priority": "must"
    },
    {
      "id": "REQ-02",
      "description": "O seletor de origem deve listar 9 moedas fiat (USD, EUR, GBP, CAD, AUD, JPY, CHF, CNY, ARS) e 15 criptomoedas (BTC, ETH, BNB, SOL, ADA, DOT, MATIC, LINK, LTC, XRP, DOGE, AVAX, SHIB, TRX, TON).",
      "priority": "must"
    },
    {
      "id": "REQ-03",
      "description": "O seletor de destino deve permitir BRL e USD para cripto, e apenas BRL (fixo) para fiat.",
      "priority": "must"
    },
    {
      "id": "REQ-04",
      "description": "A API deve suportar o cache das taxas por 5 minutos (TTL) e implementar degradação graciosa (RN-10) retornando cotação stale em caso de indisponibilidade das APIs externas.",
      "rule_ref": "RN-10",
      "priority": "must"
    },
    {
      "id": "REQ-05",
      "description": "A interface deve formatar os valores adequadamente de acordo com o destino (R$ para BRL, $ para USD) e mostrar precisão estendida (8 casas decimais) para taxas unitárias abaixo de 0.01.",
      "priority": "must"
    }
  ],
  "data_model": [],
  "api": [
    {
      "method": "GET",
      "path": "/api/market/tools/convert",
      "auth": false,
      "request": "Query params: from (string), to (string), amount (string/number)",
      "response": "JSON: { from: string, to: string, amount: string, rate: string, result: string, updatedAt: string, stale: boolean }",
      "errors": [
        "400 Parâmetro faltante ou inválido",
        "503 Serviço temporariamente indisponível (falha de rede e sem cache)"
      ]
    }
  ],
  "acceptance_criteria": [
    {
      "id": "AC-01",
      "given": "o usuário acessa a ferramenta de conversão",
      "when": "seleciona a aba Fiat",
      "then": "visualiza o dropdown de moedas contendo as 9 moedas fiat e o destino fixado em BRL"
    },
    {
      "id": "AC-02",
      "given": "o usuário acessa a ferramenta de conversão",
      "when": "seleciona a aba Cripto",
      "then": "visualiza o dropdown contendo as 15 criptomoedas e o seletor de destino habilitado com as opções BRL e USD"
    },
    {
      "id": "AC-03",
      "given": "uma falha temporária de rede com a AwesomeAPI ou CoinGecko",
      "when": "o usuário solicita uma conversão cujo valor expirou do cache de 5 minutos",
      "then": "a API retorna o último valor conhecido mapeado em fallbackRates com 'stale': true, e o frontend exibe o indicador de cotação desatualizada sem quebrar"
    },
    {
      "id": "AC-04",
      "given": "a conversão da criptomoeda SHIB",
      "when": "o resultado é renderizado",
      "then": "a taxa unitária de SHIB é exibida com precisão de 8 casas decimais"
    }
  ],
  "test_plan": [
    {
      "id": "TC-01",
      "description": "Validar renderização e alternância das abas de Fiat e Cripto no frontend.",
      "kind": "unit",
      "covers": [
        "REQ-01",
        "REQ-02",
        "REQ-03"
      ],
      "mocks_external": false
    },
    {
      "id": "TC-02",
      "description": "Testar endpoint GET /api/market/tools/convert com sucesso para novos pares fiat (CAD/BRL) e cripto (DOGE/USD).",
      "kind": "integration",
      "covers": [
        "REQ-02",
        "REQ-03",
        "REQ-04"
      ],
      "mocks_external": true
    },
    {
      "id": "TC-03",
      "description": "Testar comportamento de degradação graciosa (RN-10) simulando erro de rede na API externa com dados stale no cache.",
      "kind": "edge_case",
      "covers": [
        "REQ-04"
      ],
      "mocks_external": true
    },
    {
      "id": "TC-04",
      "description": "Testar formatação de cotação unitária abaixo de 0.01 (ex: SHIB) no frontend.",
      "kind": "unit",
      "covers": [
        "REQ-05"
      ],
      "mocks_external": false
    }
  ],
  "tasks": [
    {
      "id": "T-01",
      "description": "Adicionar novas moedas fiat em SUPPORTED_FIAT_FROM na API route.ts",
      "target": "apps/web",
      "done": false
    },
    {
      "id": "T-02",
      "description": "Adicionar novas criptomoedas (DOGE, AVAX, SHIB, TRX, TON) no CRYPTO_TICKER_MAP em ticker-map.ts",
      "target": "apps/web",
      "done": false
    },
    {
      "id": "T-03",
      "description": "Implementar mapa fallbackRates em route.ts para servir como backup em falhas de API (RN-10)",
      "target": "apps/web",
      "done": false
    },
    {
      "id": "T-04",
      "description": "Redesenhar interface do CurrencyConverter.tsx para incluir controle de abas (Fiat/Cripto) e seletor de destino",
      "target": "apps/web",
      "done": false
    },
    {
      "id": "T-05",
      "description": "Adicionar formatação especial para moedas e taxas no frontend",
      "target": "apps/web",
      "done": false
    }
  ],
  "risks": [
    "Rate limiting nas chamadas públicas de AwesomeAPI e CoinGecko: Mitigado pelo uso de cache de 5 minutos e fallback gracioso."
  ],
  "observability": [
    "Log de aviso no console do backend sempre que uma cotação stale for servida devido a falha externa."
  ],
  "rollback": "Reverter as alterações nos arquivos route.ts, ticker-map.ts e CurrencyConverter.tsx para as versões originais do repositório Git."
}
